selling_price,rank,currency,styleId,fdbId,category,run_date,paginatedUrl,source,articleType,defaultImage,description,brand,activatedAt,imageUrlList,data,sizes,url,gender,colour,mrp,attributes,styleName
63.99,1,EUR,522856780,,ALL,2018-02-21,https://www.otto.de/herrenmode/kategorien/jacken/?p=3&ps=72,otto-de,Steppjacken,https:https://i.otto.de/i/otto/16744441/studio-coletti-steppjacke-marine.jpg?$formatz$,"hängendAuslieferungca. 75 cmRückenlängedurchgehendVerschlussdetails4-Knopf-Form, ReißverschlussVerschlussBrusttasche, Eingrifftaschen, PattentaschenTaschenSeitenschlitze mit KnopfverschlussSchnittdetailsnormalPassformmit SchlitzRumpfabschlussdetailsgerader AbschlussRumpfabschlussmit KnöpfenÄrmelabschlussdetailsgerader AbschlussÄrmelabschlussÄrmel mit ÄrmelschlitzÄrmeldetailsLangarmÄrmelmit kontrastfarbenem Fleece gefüttertKragendetailsStehkragenKragenklassischStilObermaterial: 100% Polyester. Futter: 100% Polyester. Wattierung: 100% PolyesterMaterialzusammensetzungMaterial & ProduktdetailsGeschmackvoll und zeitlos präsentiert sich die Jacke von Studio Coletti. Ihre klassisch-elegante Ausstrahlung hat sie dem Regular-fit sowie den Eingriff- und Pattentaschen zu verdanken. Die wattierte, knöpfbare Herren-Steppjacke bietet dank des gefütterten Stehkragens mit den zwei Druckknöpfen und des zusätzlichen, unterlegten Reißverschlusses Schutz vor Wind und Wetter. Zudem rundet sie sowohl Freizeit- als auch Business-Outfits stilsicher ab. Mit der Jacke von Studio Coletti immer passend gekleidet!",otto-de,,https:https://i.otto.de/i/otto/16744441/studio-coletti-steppjacke-marine.jpg?$formatz$,,"46,48,50,52,54,56,58,60,62",https://www.otto.de/p/studio-coletti-steppjacke-522856780/,MEN,marine,8999.0,,Studio Coletti Steppjacke
,1,EUR,435442860,,ALL,2018-02-21,https://www.otto.de/herrenmode/kategorien/hosen/?p=3&ps=72,otto-de,Zip-off-Hosen,https:https://i.otto.de/i/otto/9311047/marco-donati-hose-mit-rundum-dehnbund-stein.jpg?$formatz$,"Hose. Je nach Witterung oder Bedarf können Sie die Hose lang tragen oder die Hosenbeine auf 3/4-Länge mit Reißverschluss abzippen. Bequem durch den Rundum-Dehnbund mit Knopf- und Reißverschluss vorne. Gürtelschlaufen. Zahlreiche Taschen: 2 schräge Taschen vorne, 2 Gesäßtaschen, 1 davon mit Reißverschluss, 1 mit Knopfverschluss. 1 Cargotasche auf dem rechten Oberschenkel mit Patte und Klettverschluss sowie kleiner Tasche mit Reißverschluss, 1 Cargotasche links mit Patte und Klettverschluss. Markant die Kontrast-Akzente an den Nähten. Funktionell die schnell trocknende, strapazierfähige Qualität. Trocknergeeignet. 97% Polyester, 3% Elasthan. Maschinenwäsche. Linke Gesäßtasche mit Knopfverschluss und rechte Gesäßtasche mit Reißverschluss.Material & Produktdetails",otto-de,,https:https://i.otto.de/i/otto/9311047/marco-donati-hose-mit-rundum-dehnbund-stein.jpg?$formatz$,,"24,25,26,27,28,29,30,31,48,50,52,54,56,58,60,62",https://www.otto.de/p/marco-donati-hose-mit-rundum-dehnbund-435442860/,MEN,marine,,,Marco Donati Hose mit Rundum-Dehnbund
16.99,1,EUR,536868181,,ALL,2018-02-21,https://www.otto.de/herrenmode/kategorien/hemden/?p=3&ps=72,otto-de,Langarm,https:https://i.otto.de/i/otto/17397985/bruno-banani-hemd-mit-totenkopfprints-weiss.jpg?$formatz$,"liegendAuslieferungmit TotenkopfprintsBesondere MerkmaleKnopfleisteVerschlussDruckeApplikationenschmalPassformabgerundeter SaumRumpfabschlussLangarmÄrmelnormaler HemdkragenKragenmodischStilbedrucktOptikObermaterial: 100% Baumwolle (unterstützt Cotton made in Africa)MaterialzusammensetzungMaterial & ProduktdetailsGenau das Richtige für trendbewusste Männer: Das Hemd von Bruno Banani, sticht durch seinen auffälligen Print sofort ins Auge. Der taillierte Schnitt mit Abnähern hinten unterstreicht den stylischen Look des geschmeidigen Herrenshirt, das zudem mit einer kleinen Labelstickerei am Ärmel aufwartet. Kombiniert mit Jeans im Used-Look und einer Bikerjacke ist man mit dem Hemd von Bruno Banani ein echter Hingucker!",otto-de,,https:https://i.otto.de/i/otto/17397985/bruno-banani-hemd-mit-totenkopfprints-weiss.jpg?$formatz$,,"S (37#ft5_slash#38),M (39#ft5_slash#40),L (41#ft5_slash#42),XL (43#ft5_slash#44),XXL (45#ft5_slash#46)",https://www.otto.de/p/bruno-banani-hemd-mit-totenkopfprints-536868181/,MEN,weiß,4999.0,,"Bruno Banani Hemd, mit Totenkopfprints"
57.99,1,EUR,245566214,,ALL,2018-02-21,https://www.otto.de/herrenmode/kategorien/anzuege/?p=3&ps=72,otto-de,Anzughosen,https:https://i.otto.de/i/otto/13796070/eterna-baukastenhose-notting-hill-baukastenfaehig-navy.jpg?$formatz$,"hängendAuslieferungnachtblauHerstellerfarbbezeichnungIn Gr. 50 ca. 39 cmFußweiteIn Gr. 50 ca. 82 cmInnenbeinlängeBaukastenfähigBesondere MerkmalePaspeltaschen, EingrifftaschenTaschenÖsen, HakenApplikationen4,5 cmLänge der GürtelschlaufelangSchnittform LängeBügelfaltenSchnittdetailsschmalPassformgeradeBeinformniedrigerLeibhöheklassischStilunifarbenOptikObermaterial: 100% Schurwolle. Futter: 100% Polyester. Kniefutter: 100% PolyesterMaterialzusammensetzungMaterial & ProduktdetailsDie Klassische: Mit dieser Baukastenhose von eterna comfort fit aus reiner Schurwolle liegt man immer richtig. Schnörkellos mit geradem Bein, ohne Bundfalten und ohne Umschlag, ist sie zu allen Anlässen das passende, baukastenfähige Beinkleid. Die Verwendung von reiner Schurwolle in feiner Super100-Qualität schafft in Verbindung mit einem hochwertigen Synthetikfutter, das knapp unter dem Knie endet, ein angenehmes Trageklima rund ums Jahr. Zwei Gesäßtaschen sind mit Knopf schließbar. Bei dieser eterna comfort fit -Hose stehen hohe Qualität und exzellente Verarbeitung im Vordergrund. Ein wahres Allheilmittel für stilsichere Business- und gehobene Freizeitoutfits.",otto-de,,https:https://i.otto.de/i/otto/13796070/eterna-baukastenhose-notting-hill-baukastenfaehig-navy.jpg?$formatz$,,"44,46,48,50,52,54,56,58",https://www.otto.de/p/eterna-baukastenhose-notting-hill-baukastenfaehig-245566214/,MEN,navy,8999.0,,"Eterna Baukastenhose »Notting Hill«, Baukastenfähig"
,2,EUR,633870968,,ALL,2018-02-21,https://www.otto.de/herrenmode/kategorien/hemden/?p=3&ps=72,otto-de,Langarm,https:https://i.otto.de/i/otto/21027607/s-oliver-red-label-slim-hemd-aus-leichtem-twill-charcoal.jpg?$formatz$,"Obermaterial: 100% BaumwolleMaterialzusammensetzung:Hemd Fein strukturierte Faux-Uni-Optik. Haikragen mit herausnehmbaren Kragenstäbchen. Eine aufgesetzte Brusttasche mit kleinem Label-Patch. Sportmanschetten mit knöpfbarem Dachschlitz. Chambray-Besatz an Kragensteg, Knopfleiste und Manschetten. Schmale Passform Slim Fit mit leichter Taillierung und abgerundetem Saumabschluss; Rückenlänge bei Größe M ca. 76 cm. Fein texturiertes und leichtes Baumwollgewebe. Das modern geschnittene Baumwollhemd kann sich sowohl am Casual Friday als auch am Wochenende sehen lassen..Material & Produktdetails",otto-de,,https:https://i.otto.de/i/otto/21027607/s-oliver-red-label-slim-hemd-aus-leichtem-twill-charcoal.jpg?$formatz$,,"S,M,L,XL,XXL",https://www.otto.de/p/s-oliver-red-label-slim-hemd-aus-leichtem-twill-633870968/,MEN,beau blue,,,s.Oliver RED LABEL Slim: Hemd aus leichtem Twill
,2,EUR,599704254,,ALL,2018-02-21,https://www.otto.de/herrenmode/kategorien/hosen/?p=3&ps=72,otto-de,Komforthosen,https:https://i.otto.de/i/otto/19139047/roger-kent-schlupfhose-mit-gummibund-mit-kordelzug-blue-bleached.jpg?$formatz$,Denimfarben: Blue bleachedMuster: UniSchlupfhose Material :100% BaumwolleSchlupfhose mit Gummizugbund und Kordelzug. 2 Einstecktaschen und 1 Gesäßtasche. Material: 100% Baumwolle.Material & Produktdetails,otto-de,,https:https://i.otto.de/i/otto/19139047/roger-kent-schlupfhose-mit-gummibund-mit-kordelzug-blue-bleached.jpg?$formatz$,,"24,25,26,27,28,29,46,48,50,52,54,56,58,60,62,64",https://www.otto.de/p/roger-kent-schlupfhose-mit-gummibund-mit-kordelzug-599704254/,MEN,blue bleached,,,Roger Kent Schlupfhose mit Gummibund mit Kordelzug
159.95,2,EUR,633456433,,ALL,2018-02-21,https://www.otto.de/herrenmode/kategorien/jacken/?p=3&ps=72,otto-de,Parka,https:https://i.otto.de/i/otto/20685392/schmuddelwedda-parka-schwarz.jpg?$formatz$,"ParkaÄrmellänge: 73cmVerschluss: Reißverschluss + DruckknopfTaschen: Zweiwegeeingriff-PattentaschePflegehinweise: nicht waschen, nicht bleichen, nicht Maschinen-Trocknen, nicht bügeln, chemische Reinigung möglich, keinen Weichspüler verwendenPassform: normalOberteillänge: normalMuster: UniMaterial Ärmelfutter: 100% PolyesterMaterial Rippe: 100% PolyesterMaterial Oberstoff: 100% PolyesterMaterial Füllung: 100% PolyesterMaterial: 100% PolyesterKragen: StehkragenKapuze: angesetztHerstellungsland und -region: ChinaGrößenflag: fällt normal ausGesamtlänge/Rückenlänge Größe S: 90cmFutter: 100% Polyesterbreite: 59cmDieser Herren Parka bietet alles, was man für gelungene Outdoor-Aktivitäten braucht! Er ist wasserabweisend und im Inneren angenehm weich. Der Parka besitzt einen wertigen Reißverschluss, der mit einer mit Kinnschutz versehenen Knopfleiste verdeckt wird. Die angesetzte Kapuze besitzt einen Tunnelzug mit Kordel und maritime Details. Der Parka hat zwei aufgesetzte Zweiwegeeingriff-Pattentaschen und eine Innentasche. Auf Brusthöhe befindet sich im Innenbereich eine Reißverschlusstasche und eine Öse, durch diese Kopfhörerkabel gezogen werden können. Des Weiteren befindet sich auf Taillenhöhe ein Tunnelzug mit maritimen Kordeln, wodurch der Parka bei Bedarf enger gemacht werden kann.ParkaMaterial & Produktdetails",otto-de,,https:https://i.otto.de/i/otto/20685392/schmuddelwedda-parka-schwarz.jpg?$formatz$,,"S (48),M (50),L (52),XL (54),XXL (56)",https://www.otto.de/p/schmuddelwedda-parka-633456433/,MEN,dunkelbraun,23995.0,,Schmuddelwedda Parka
39.95,2,EUR,568227891,,ALL,2018-02-21,https://www.otto.de/herrenmode/kategorien/jeans/?p=3&ps=72,otto-de,Slim-fit-Jeans,https:https://i.otto.de/i/otto/17526040/timezone-jeans-ricktz-worker-pants-blue-graphite.jpg?$formatz$,"Material:100% Baumwollegeprägte silberfarbene Nieten und Knöpferobuster Canvasdezente Ziernähteenthält nichttextile Teile tierischen UrsprungsCoinpocket und 1 Gürtelschlaufe mit Leder2 große aufgenähte Taschen seitlich, 1 Coinpocket rechtsgroße Gesäßtaschen, davon 1 mit Innentaschegefärbte Baumwolle, glatt und leichtschmal geschnittener Beinverlaufmit Knopf und Reißverschluss zum SchließenRICK TZ slim fit, slim leg, Worker PantsHerren Worker-Hose von TIMEZONE in BaumwolleHerren Regular fit CottonHerren regular fit Worker Hose RICK TZ mit schmalen Bein in gedeckten Farben von TIMEZONE.Material & Produktdetails",otto-de,,https:https://i.otto.de/i/otto/17526040/timezone-jeans-ricktz-worker-pants-blue-graphite.jpg?$formatz$,,"28,29,30,31,32,33,34,36,38,40",https://www.otto.de/p/timezone-jeans-ricktz-worker-pants-568227891/,MEN,blue graphite,8995.0,,TIMEZONE Jeans »RickTZ worker pants«
,2,EUR,660970809,,ALL,2018-02-21,https://www.otto.de/herrenmode/kategorien/polo-shirts/?p=3&ps=72,otto-de,Kurzarm,https:https://i.otto.de/i/otto/22737456/lerros-basic-poloshirt-white.jpg?$formatz$,Das klassische Poloshirt in feiner Piquéqualität von LERROS ist ein Must-Have für jeden Kleiderschrank und lässt Sie zu jeder Gelegenheit gut aussehenMaterial & Produktdetails,otto-de,,https:https://i.otto.de/i/otto/22737456/lerros-basic-poloshirt-white.jpg?$formatz$,,"M,L,XL,XXL,XXXL",https://www.otto.de/p/lerros-basic-poloshirt-660970809/,MEN,BLACK,,,LERROS Basic Poloshirt
29.99,2,EUR,654636942,,ALL,2018-02-21,https://www.otto.de/herrenmode/kategorien/pullover/?p=3&ps=72,otto-de,Pullover,https:https://i.otto.de/i/otto/23320592/tom-tailor-denim-strickpullover-basic-pullover-mit-v-ausschnitt-dunkelgrau.jpg?$formatz$,"LangarmÄrmelcasualStil50 % Polyester 23 % Polyacryl 21 % Polyamid 6 % WolleMaterialzusammensetzungMaterial & ProduktdetailsBasic Pullover mit V-Ausschnitt für Männer (unifarben, langärmlig mit V-Ausschnitt) aus Feinstrick in Melange-Optik, mit Logo-Badge vorne am Saum, abgesetzte Blenden an den Saumkanten",otto-de,,https:https://i.otto.de/i/otto/23320592/tom-tailor-denim-strickpullover-basic-pullover-mit-v-ausschnitt-dunkelgrau.jpg?$formatz$,,"S,M,L,XL,XXL",https://www.otto.de/p/tom-tailor-denim-strickpullover-basic-pullover-mit-v-ausschnitt-654636942/,MEN,blue,3999.0,,Tom Tailor Denim Strickpullover »Basic Pullover mit V-Ausschnitt«
,2,EUR,641499492,,ALL,2018-02-21,https://www.otto.de/herrenmode/kategorien/sakkos/?p=3&ps=72,otto-de,Anzugsakkos,https:https://i.otto.de/i/otto/21278240/thomas-goodwin-baukastensakko-bob-mit-leichtem-streifen-schwarz.jpg?$formatz$,mit leichtem StreifenBesondere Merkmale2-Knopf-FormVerschlussPattentaschenTaschenSeitenschlitzeSchnittdetailsLangarmÄrmelelastischMaterialeigenschaften54% Schurwolle/43% Polyester/3% ElasthanMaterialzusammensetzungMaterial & ProduktdetailsDas Mix & Match-Baukastensakko Bradly im Modern Fit lässt sich optimal mit der passenden Hose Benny zu einem Business- Anzug kombinieren. Das 2-Knopf-Sakko ist mit zwei Pattentaschen und einer Brustleiste ausgestattet. Und verfügt über 4 Innentaschen und zwei Rückenschlitze für den optimalen Sitz.,otto-de,,https:https://i.otto.de/i/otto/21278240/thomas-goodwin-baukastensakko-bob-mit-leichtem-streifen-schwarz.jpg?$formatz$,,"23,24,25,26,27,28,29,30,44,46 (S),48 (M),50 (L),52 (XL),54 (XXL),56,58,60,90,94,98,102,106,110,114",https://www.otto.de/p/thomas-goodwin-baukastensakko-bob-mit-leichtem-streifen-641499492/,MEN,schwarz,,,"Thomas Goodwin Baukastensakko »BOB«, mit leichtem Streifen"
,2,EUR,612029121,,ALL,2018-02-21,https://www.otto.de/herrenmode/kategorien/shirts/?p=3&ps=72,otto-de,Rundhals,https:https://i.otto.de/i/otto/20737715/mustang-t-shirt-white.jpg?$formatz$,"liegendAuslieferungDruckApplikationenschmalPassformKurzarmÄrmelRundhalsAusschnittcasualStilbedrucktOptikSingle JerseyMaterialartObermaterial: 100% BaumwolleMaterialzusammensetzungMaterial & ProduktdetailsDas T-Shirt »SlubYarn« von Mustang kommt mit einem coolen Frontdruck, der urbane Outfits perfekt macht. Für hohen Tragekomfort sorgt das weiche, leicht strukturierte Slub-yarn-Baumwollgewebe, das dem Ganzen eine coole Note verleiht und den stylischen Casual-Look des Herrenshirts unterstreicht. Ein maskuliner Rundhalsausschnitt und kurze Ärmel ergänzen das schmal geschnittene Basic-Piece perfekt. Tipp: Am besten kombiniert man das unkomplizierte Kurzarmshirt mit Jeans, Fliegerjacke und Sneakers. Unablässig für einen authentischen Streetstyle: das bedruckte »SlubYarn«-T-Shirt von Mustang!",otto-de,,https:https://i.otto.de/i/otto/20737715/mustang-t-shirt-white.jpg?$formatz$,,"S (44#ft5_slash#46),M (48#ft5_slash#50),L (52#ft5_slash#54),XL (56#ft5_slash#58),XXL (60#ft5_slash#62)",https://www.otto.de/p/mustang-t-shirt-612029121/,MEN,white,,,MUSTANG T-Shirt
,2,EUR,665739750,,ALL,2018-02-21,https://www.otto.de/herrenmode/kategorien/shorts/?p=3&ps=72,otto-de,Fußballhosen,https:https://i.otto.de/i/otto/lh_platzhalter_ohne_abbildung,FußballSportartmulticolorHerstellerfarbbezeichnungkeineKompressionReißverschlusstaschenTaschenkurzSchnittform Längeelastischer BundBundabschlusssportlichStilunifarbenOptikatmungsaktivMaterialeigenschaften100% PolyesterMaterialzusammensetzungMaterial & ProduktdetailsDri-FIT-Technologie leitet Schweiß von der Haut nach außen ab und hält dich angenehm trocken. Der elastische Bund mit integriertem Kordelzug lässt sich für eine perfekte Passform individuell verstellen. Seitliche Reißverschlusstaschen bieten praktischen Stauraum. Der Nike Swoosh auf dem Bein rundet die atmungsaktive Hose gekonnt ab.Die Academy 18 Short bietet trockenen Tragekomfort und unterstützt dich perfekt im Training.,otto-de,,https:https://i.otto.de/i/otto/lh_platzhalter_ohne_abbildung,,"S - 40#ft5_slash#42,M - 44#ft5_slash#46,L - 48#ft5_slash#50,XL - 52#ft5_slash#54,XXL - 56#ft5_slash#58",https://www.otto.de/p/nike-shorts-academy-18-665739750/,MEN,dunkelblau,,,Nike Shorts »Academy 18«
13.99,2,EUR,651126382,,ALL,2018-02-21,https://www.otto.de/herrenmode/kategorien/sweatshirts-jacken/?p=3&ps=72,otto-de,Rundhalspullover,https:https://i.otto.de/i/otto/23804509/cyprime-rundhalspullover-titanium-blau.jpg?$formatz$,"Material: 80% Baumwolle, 20% PolyesterMaterialzusammensetzungMaterial & ProduktdetailsTrage es & liebe es! Pullover 'Titanium' von der Marke Cyprime für Herren, ist sehr angenehm zu tragen und überzeugt durch einen schicken und modernen Schnitt. Dank dem freshen Look sind casual Streetstyles kein Problem. Mit Cyprime sind Sie immer gut angezogen.",otto-de,,https:https://i.otto.de/i/otto/23804509/cyprime-rundhalspullover-titanium-blau.jpg?$formatz$,,"S,M,L,XL,XXL,XXXL",https://www.otto.de/p/cyprime-rundhalspullover-titanium-651126382/,MEN,blau,2799.0,,Cyprime Rundhalspullover »Titanium«
,2,EUR,635454783,,ALL,2018-02-21,https://www.otto.de/herrenmode/accessoires/krawatten/?p=3&ps=72,otto-de,Breite Krawatten,https:https://i.otto.de/i/otto/21207049/next-krawatte-und-gemustertes-quadratisches-einstecktuch-im-set-2-teilig-red.jpg?$formatz$,"Maschinenwäsche: 40 °C, normales Waschprogramm. Nicht bleichen. Nicht im Wäschetrockner trocknen. Kalt bügeln. Fachgerechte chemische Reinigung ohne Trichlorethylen.Krawatte und Einstecktuch: 100 % Polyester.Krawatte und gemustertes quadratisches Einstecktuch im Set.Material & Produktdetails",otto-de,,https:https://i.otto.de/i/otto/21207049/next-krawatte-und-gemustertes-quadratisches-einstecktuch-im-set-2-teilig-red.jpg?$formatz$,,,https://www.otto.de/p/next-krawatte-und-gemustertes-quadratisches-einstecktuch-im-set-2-teilig-635454783/,MEN,Red,,,Next Krawatte und gemustertes quadratisches Einstecktuch im Set 2 teilig
,2,EUR,125247709,,ALL,2018-02-21,https://www.otto.de/herrenmode/accessoires/schmuck/?p=3&ps=72,otto-de,Lederarmbänder,https:https://i.otto.de/i/otto/6851637/j-jayz-lederarmband-zum-wickeln-schwarz.jpg?$formatz$,"90 cmGesamtlänge Armschmuckzum WickelnBesondere MerkmaleDornverschlussVerschlussartLederMaterialMaterial & ProduktdetailsHingucker fürs Handgelenk: Das Leder-Armband mit goldfarbener Schließe zum Wickeln ist das Trend-Accessoire der Saison. It-Pieces aus Leder sind eine perfekte Ergänzung für Khaki-Pants und Chinos. Aber auch lässige Jeans machen sich gut an der Seite des ausgefallenen Teils. Wer es etwas extravaganter mag, trägt das Wickel-Armband aus Leder zusammen mit der Uhr und Textilbändern am gleichen Arm im sogenannten Mix-und-match-Style.",otto-de,,https:https://i.otto.de/i/otto/6851637/j-jayz-lederarmband-zum-wickeln-schwarz.jpg?$formatz$,,,https://www.otto.de/p/j-jayz-lederarmband-zum-wickeln-125247709/,MEN,schwarz,,,"J.Jayz Lederarmband, zum Wickeln"
,2,EUR,410332006,,ALL,2018-02-21,https://www.otto.de/herrenmode/accessoires/uhren/?p=3&ps=72,otto-de,Quarzuhren,https:https://i.otto.de/i/otto/5436757/casio-edifice-armbanduhr-ef-129d-1avef-silberfarben.jpg?$formatz$,"Wasserdicht bis 10 barMineralglas gewölbtVerschraubter GehäusebodenSicherheitsverschlussEdelstahlbandEdelstahlgehäuse, Ø ca. 45 mmDatumNEO-DisplayQuartzwerkCasio Edifice, Armbanduhr, ""EF-129D-1AVEF"". Edifice-Uhren stehen für Funktionalität von klassisch bis modern. Für Menschen mit Stil, die viel Wert auf Design und Qualität legen.Material & Produktdetails",otto-de,,https:https://i.otto.de/i/otto/5436757/casio-edifice-armbanduhr-ef-129d-1avef-silberfarben.jpg?$formatz$,,,https://www.otto.de/p/casio-edifice-armbanduhr-ef-129d-1avef-410332006/,MEN,silberfarben,,,"Casio Edifice, Armbanduhr, ""EF-129D-1AVEF"""
,3,EUR,520198887,,ALL,2018-02-21,https://www.otto.de/herrenmode/kategorien/hemden/?p=3&ps=72,otto-de,Langarm,https:https://i.otto.de/i/otto/20012188/eterna-langarm-hemd-langarm-hemd-slim-fit-weiss.jpg?$formatz$,"enthält nichttextile Bestandteile tierischen Ursprungs: neinStoffverarbeitung: gewebtSchnitt: SLIM FITPflegehinweis chemische Reinigung: keine chemische Reinigung möglichPflegehinweis bügeln: mäßig heiß bügelnPflegehinweis trocknen: Trocknen mit reduzierter thermischer BeanspruchungPflegehinweis bleichen: nicht bleichenPflegehinweis waschen: Schonwaschgang 40°Passform: schmalMuster: unifarbenMaterial-Qualität: PopelineMaterial: 100% BaumwolleManschettentyp: KombimanschetteKragenform: Hai-Kragenbügeln: NON IRON (bügelfrei)Atmungsaktiv: jaAnzahl von Brusttaschen: ohne BrusttascheModelgröße: Unser Model ist 1,84 m groß (Armlänge 64 cm) und trägt die Größe 40.Bestellen Sie heute noch dieses Langarmhemd (ohne Brusttasche) gefertigt aus feinster Baumwolle (Finest Fabrics by Swiss Excellent, bügelfrei) und bringen Sie zeitlose Modernität in Ihren Kleiderschrank.Egal ob sportlich zu Jeans und Sneakers oder elegant mit Anzug und Krawatte kombiniert, sind Sie mit diesem Hemd mit Hai-Kragen stets perfekt gekleidet!Es besticht vor allem durch das schlichte Design und die figurbetonte Schnittführung.Dieses Uni Popeline Businesshemd ist ein zeitloser Klassiker!Langarm Hemd Langarm Hemd SLIM FITMaterial & Produktdetails",otto-de,,https:https://i.otto.de/i/otto/20012188/eterna-langarm-hemd-langarm-hemd-slim-fit-weiss.jpg?$formatz$,,"37,38,39,40,41,42,43,44,45,46",https://www.otto.de/p/eterna-langarm-hemd-langarm-hemd-slim-fit-520198887/,MEN,hellblau,,,ETERNA Langarm Hemd »Langarm Hemd SLIM FIT«
24.99,3,EUR,603540641,,ALL,2018-02-21,https://www.otto.de/herrenmode/kategorien/hosen/?p=3&ps=72,otto-de,Komforthosen,https:https://i.otto.de/i/otto/19414184/men-plus-by-happy-size-stretch-hose-petrol.jpg?$formatz$,"He.-Jeans MW,beige Material : 98% Baumwolle (Twill) 2% Elasthan 98% Baumwolle 2% ElasthanHe.-Jeans MW,beige Material : 98% Baumwolle 2% Elasthan 98% Baumwolle 2% Elasthan 98% Baumwolle 2% ElasthanPflegehinweise: MaschinenwäscheMuster: UniHe.-Jeans MW Material : 98% Baumwolle 2% ElasthanGrößenangepasste Schrittlänge: N-Gr.: 83-91 cm, U-Gr.:79-86 cmDiese Hose in 5-Pocket Form überzeugt mit Tragekomfort und ist kombifreundlich. Eine gute Grundlage für die gepflegte Garderobe. Der gerade Beinverlauf und der Stretch-Anteil sorgen für einen bequemen Sitz.Material & Produktdetails",otto-de,,https:https://i.otto.de/i/otto/19414184/men-plus-by-happy-size-stretch-hose-petrol.jpg?$formatz$,,"25,26,27,28,29,30,31,32,33,34,35,50,52,54,56,58,60,62,64,66,68,70,72,74",https://www.otto.de/p/men-plus-by-happy-size-stretch-hose-603540641/,MEN,beige,3499.0,,Men Plus by Happy Size Stretch-Hose
,3,EUR,608818180,,ALL,2018-02-21,https://www.otto.de/herrenmode/kategorien/jacken/?p=3&ps=72,otto-de,Blousons,https:https://i.otto.de/i/otto/20720031/blend-blouson-mit-meshfutter-marine.jpg?$formatz$,"liegendAuslieferungIn Gr. M (46/48) ca. 72 cmRückenlängemit MeshfutterBesondere MerkmaleReißverschlussVerschlussReißverschlusstaschen, InnentascheTaschenMarkenlabelApplikationenmit KapuzeKapuzeschmalPassformBündchenRumpfabschlussBündchenÄrmelabschlussLangarmÄrmelmodischStilunifarben mit FarbeinsätzenOptikObermaterial: 100% Polyester. Futter: 100% PolyesterMaterialzusammensetzungMaterial & ProduktdetailsSuperleicht. Superlässig. Auf einen Blouson wie diesen von Blend aus strapazierfähigem Nylon haben Männer schon gewartet. Die Kapuzenjacke ist einfach das perfekte Basicteil für einen lässig-maritimen Casual-Look. Die beiden Eingrifftaschen seitlich sind mit kontrastfarbenen Reißverschlüssen versehen. Dort lassen sich Geld, Schlüssel und Handy sicher verstauen. Die ebenfalls kontrastfarben gestreiften Rippbündchen an Saum und Ärmelabschluss schließen enganliegend ab und schützen zusätzlich vor kühlem Wind. Toll ist auch der figurnahe, schmale Schnitt, der diesem Klassiker unter den Windjacken den modischen Schliff verleiht. Hier gibts nichts zu überlegen, den muss man einfach haben: den Blouson von Blend.",otto-de,,https:https://i.otto.de/i/otto/20720031/blend-blouson-mit-meshfutter-marine.jpg?$formatz$,,"S (44),M (46#ft5_slash#48),L (50),XL (52),XXL (54#ft5_slash#56)",https://www.otto.de/p/blend-blouson-mit-meshfutter-608818180/,MEN,marine,,,"Blend Blouson, mit Meshfutter"
,3,EUR,459637752,,ALL,2018-02-21,https://www.otto.de/herrenmode/kategorien/jeans/?p=3&ps=72,otto-de,Straight-fit-Jeans,https:https://i.otto.de/i/otto/23100795/cross-jeans-relax-fit-jeans-antonio-besonderes-stitching-an-den-gesaesstaschen-rinsed.jpg?$formatz$,"Besonderes Stitching an den GesäßtaschenBesondere MerkmaleReißverschlussVerschlussnormalSchnittform LängegeradeBeinformnormalLeibhöherinsedWaschungcasualStilcleanOptikelastischMaterialeigenschaften98% COTTON 2%ELASTHANMaterialzusammensetzungMaterial & ProduktdetailsAntonio von CROSS Jeans. Im komfortablen Relaxed-Fit präsentiert sich die lässige Antonio-Jeans und erweist sich mit zweifarbigen Nähten und vielen verschiedenen Waschungen als coole Basic Jeans ob in der Freizeit oder edel zum Sakko. Die griffige Denim-Qualität macht die Jeans robust und strapazierfähig. Neue Cross Details wie z.B.hochwertiges Leder-Logo Patch rückseitig am Bund, sehr aufwendig gearbeitetes Cross Logo an der Gesäßtasche, Knöpfe und Nieten mit Logoprägung. Details gut zu sehen auf den Detailbildern. Enthält nicht textile Teile tierischen Ursprungs (Leder-Logo-Patch am Bund).",otto-de,,https:https://i.otto.de/i/otto/23100795/cross-jeans-relax-fit-jeans-antonio-besonderes-stitching-an-den-gesaesstaschen-rinsed.jpg?$formatz$,,,https://www.otto.de/p/cross-jeans-relax-fit-jeans-antonio-besonderes-stitching-an-den-gesaesstaschen-459637752/,MEN,black,,,"Cross Jeans® Relax-fit-Jeans »Antonio«, Besonderes Stitching an den Gesäßtaschen"
