selling_price,rank,currency,styleId,fdbId,category,run_date,paginatedUrl,source,articleType,defaultImage,description,brand,activatedAt,imageUrlList,data,sizes,url,gender,colour,mrp,attributes,styleName
99.99,1,EUR,568522494,,ALL,2018-02-21,https://www.otto.de/herrenmode/kategorien/anzuege/?p=1&ps=72,otto-de,Anzüge,https:https://i.otto.de/i/otto/18955180/bruno-banani-anzug-anthrazit.jpg?$formatz$,"hängendAuslieferungIn Gr. 25 ca. 39 cmFußweite HoseIn Gr. 25 ca. 78 cmInnenbeinlänge HoseIn Gr. 25 ca. 73 cmRückenlänge SakkoIn Gr. 25 ca. 116 cmOberweite SakkoeinreihigVerschlussdetails Sakko2-Knopf-FormVerschluss SakkoPattentaschen, Brusttasche, Billettasche, InnentaschenTaschen SakkoReißverschluss, Haken, ÖseVerschluss HoseEingrifftaschen, GesäßtaschenTaschen HosejaGürtelschlaufenschmalPassformlangSchnittform Länge HoseBügelfalteSchnittdetails Hosegerader AbschlussBeinabschluss HoseniedrigerLeibhöhe HoseRückenschlitzSchnittdetails Sakkogerader AbschlussRumpfabschluss Sakkogerader AbschlussÄrmelabschluss Sakkomit KnöpfenÄrmeldetails SakkoLangarmÄrmel SakkoReverskragenKragen SakkoklassischStilStrukturmusterOptikStretchMaterialeigenschaftenObermaterial: 77% Polyester, 21% Viskose, 2% Elasthan. Futter: 100% PolyesterMaterialzusammensetzungMaterial & ProduktdetailsBereit fürs Business! Der moderne Anzug von Bruno Banani begeistert als Klassiker mit aktuellen Akzenten. Der feine Zweiteiler präsentiert sich mit einem leicht taillierten Sakko und einer schmal geschnittenen Anzughose inklusive niedriger Leibhöhe. Diverse Eingrifftaschen mit akzentuierter Paspelierung machen den Modern-fit-Anzug zum Blickfang. Das Herrensakko überzeugt zusätzlich mit einer geknöpften Billetttasche, einem schmalen Reverskragen und langen Manschettenärmeln. Die Anzughose punktet verlässlich mit Bund samt Gürtelschlaufen und schicker Bügelfalte. Die formbeständige, elastische Qualität des Herrenanzugs trägt sich sehr angenehm. Ein stilsicherer Look gelingt zu jeder Zeit mit Hemd, Schnürschuhen und dem Anzug von Bruno Banani.",otto-de,,https:https://i.otto.de/i/otto/18955180/bruno-banani-anzug-anthrazit.jpg?$formatz$,,"24,25,26,27,44,46,48,50,52,54,56,58,90,94,98,102,106,110",https://www.otto.de/p/bruno-banani-anzug-568522494/,MEN,anthrazit,12999.0,,Bruno Banani Anzug
,1,EUR,623209339,,ALL,2018-02-21,https://www.otto.de/herrenmode/kategorien/hemden/?p=1&ps=72,otto-de,Langarm,https:https://i.otto.de/i/otto/22112558/tommy-jeans-hemd-tjm-basic-solid-shirt-l-s-38-hellblau-meliert.jpg?$formatz$,"liegendAuslieferungNAUTICAL BLUEHerstellerfarbbezeichnungKnopfleisteVerschlussBrusttascheTaschenMarkenlabelApplikationenschmalPassformabgerundeter SaumRumpfabschluss2-Knopf-ManschetteÄrmelabschlussLangarmÄrmelnormaler HemdkragenKragenmodischStilmeliertOptikObermaterial: 100% BaumwolleMaterialzusammensetzungMaterial & ProduktdetailsMit dem stilvollen Hemd von Hilfiger Denim in melierter Optik werden Freizeitoutfits perfekt abgerundet. Das Herrenhemd begeistert mit einem klassischen Design und einem dezenten Markenlabel auf der Brusttasche. Die in Kontrastfarben gehaltene Innenseite des Kragens und der Manschetten verleihen dem Langarmhemd aus einer trageangenehmen Qualität einen sportiven Touch. Der abgerundete Saum komplettiert die lässige Optik. Zu einer schmalen Jeans und Sneakern kombiniert macht das Herrenhemd immer eine gute Figur. Egal zu welchem Anlass, mit dem Hemd von Hilfiger Denim wird das Styling unkompliziert!",otto-de,,https:https://i.otto.de/i/otto/22112558/tommy-jeans-hemd-tjm-basic-solid-shirt-l-s-38-hellblau-meliert.jpg?$formatz$,,"S (35#ft5_slash#36),M (37#ft5_slash#38),L (39#ft5_slash#40),XL (41#ft5_slash#42),XXL (43#ft5_slash#44)",https://www.otto.de/p/tommy-jeans-hemd-tjm-basic-solid-shirt-l-s-38-623209339/,MEN,hellblau-meliert,,,TOMMY JEANS Hemd »TJM BASIC SOLID SHIRT L/S 38«
79.99,1,EUR,517824288,,ALL,2018-02-21,https://www.otto.de/herrenmode/kategorien/hosen/?p=1&ps=72,otto-de,Cargohosen,https:https://i.otto.de/i/otto/16716809/g-star-raw-cargohose-rovic-zip-3d-tapered-beige.jpg?$formatz$,"liegendAuslieferungduneHerstellerfarbbezeichnungim SchrittVerschlussdetailsReißverschlussVerschlussEingrifftaschen, Coinpocket, Pattentaschen, GesäßtaschenTaschenLabelApplikationenjaGürtelschlaufenlangSchnittform LängenormalPassformgerade, unten schmalBeinformnormalLeibhöhemodischStilunifarbenOptikObermaterial: 97% Baumwolle, 3% ElasthanMaterialzusammensetzungMaterial & ProduktdetailsFür den modebewussten Mann! Der lässige Stil der Cargohose »Rovic« von G-Star wird durch die beiden aufgesetzten Cargotaschen am Oberschenkel bestimmt. Über einer Tasche ist eine zusätzliche Reißverschlusstasche angebracht. Die coolen Teilungsnähte sorgen für einen komfortablen Tapered-fit-Style. Pattentaschen hinten runden den angesagten Worker-Stil der Hose ab. Ob lässig mit Hemd getragen oder cool mit Retro-Shirt – die robuste Hose lässt sich vielseitig kombinieren. So wird die unkomplizierte Cargohose »Rovic« von G-Star schnell zur Lieblingshose!",otto-de,,https:https://i.otto.de/i/otto/16716809/g-star-raw-cargohose-rovic-zip-3d-tapered-beige.jpg?$formatz$,,,https://www.otto.de/p/g-star-raw-cargohose-rovic-zip-3d-tapered-517824288/,MEN,anthrazit,9999.0,,G-Star RAW Cargohose »Rovic Zip 3D tapered«
89.99,1,EUR,599335370,,ALL,2018-02-21,https://www.otto.de/herrenmode/kategorien/jeans/?p=1&ps=72,otto-de,Straight-fit-Jeans,https:https://i.otto.de/i/otto/20721725/g-star-raw-straight-jeans-3301-decons-vintage-aged.jpg?$formatz$,"In Gr. 34 ca. 81 cmInnenbeinlängeStickereiApplikationenlangSchnittform LängenormalPassformgeradeBeinformnormalLeibhöhemodischStilDenim/JeansMaterialartObermaterial: 98% Baumwolle, 2% ElasthanMaterialzusammensetzungMaterial & ProduktdetailsDie Kultmarke G-Star überzeugt auch bei der 5-Pocket-Jeans »3301 Decons« auf den ersten Blick. Sehr cool ist die aufwendig gearbeitete Washed-Optik, die authenisch daherkommt. Die hochwertige Baumwollqualität trägt sich dank Stretchanteil superangenehm. Die Hose ist gerade geschnitten und kann damit gut auch zu Boots oder Stiefeln getragen werden. Wer möchte, krempelt den Saum zwei Mal um und schon entsteht ein ganz neuer Look. Für einen maskulinen Auftritt kombiniert man die Jeans mit einem lässigen T-Shirt und einer Lederjacke im Bikerstyle. Fazit: Die »3301 Decons« ist eine tolle Basic-Jeans von G-Star, in der Männer sich rundum wohlfühlen!",otto-de,,https:https://i.otto.de/i/otto/20721725/g-star-raw-straight-jeans-3301-decons-vintage-aged.jpg?$formatz$,,,https://www.otto.de/p/g-star-raw-straight-jeans-3301-decons-599335370/,MEN,medium-aged,12999.0,,G-Star RAW Straight-Jeans »3301 Decons«
28.99,1,EUR,643046987,,ALL,2018-02-21,https://www.otto.de/herrenmode/kategorien/jacken/?p=1&ps=72,otto-de,Blousons,https:https://i.otto.de/i/otto/22929089/crosshatch-blousonjacke-marine.jpg?$formatz$,"liegendAuslieferungIn Gr. M (48/50) ca. 70 cmRückenlängeReißverschlussVerschlussEingrifftaschenTaschenBadgeApplikationenFellimitat an der KapuzeKapuzendetailsmit KapuzeKapuzenormalPassformBündchenRumpfabschlussBündchenÄrmelabschlussLangarmÄrmelnormaler KragenKragenmodischStilpflegeleichtMaterialeigenschaftenObermaterial: 100% Nylon. Futter: 100% Polyester. Wattierung: 100% PolyesterMaterialzusammensetzungMaterial & ProduktdetailsNie mehr frieren mit der Blousonjacke von Crosshatch! Diverse Details sorgen bei dieser warmen Steppjacke für Wohlbefinden. Eine Kapuze mit Kunstfellkragen, elastische Stickbündchen an den Ärmeln und am Saum sorgen dafür, dass kalte Luft kein Problem mehr ist. Superpraktisch sind die beiden seitlichen Eingrifftaschen des Blousons, eine Tasche auf dem rechten Ärmel und eine Reißverschlusstasche auf der linken Brust – Platz genug für alles, was unbedingt mit muss. Modische Logos an Ärmel und Ärmelsaum und eine angedeutete Steppoptik liefern trendige Akzente. Mit der Blousonjacke von Crosshatch ist man auf jeden Fall optimal ausgerüstet!",otto-de,,https:https://i.otto.de/i/otto/22929089/crosshatch-blousonjacke-marine.jpg?$formatz$,,"S (46),M (48#ft5_slash#50),L (52),XL (54),XXL (56)",https://www.otto.de/p/crosshatch-blousonjacke-643046987/,MEN,marine,5999.0,,CROSSHATCH Blousonjacke
,1,EUR,617156913,,ALL,2018-02-21,https://www.otto.de/herrenmode/kategorien/polo-shirts/?p=1&ps=72,otto-de,Langarm,https:https://i.otto.de/i/otto/22093037/gant-rugbyshirt-weiss-blau.jpg?$formatz$,"liegendAuslieferungeggshellHerstellerfarbbezeichnungLogostickereiApplikationenRippstrickbündchenÄrmelabschlussLangarmÄrmelPolokragenKragencasualStilgestreiftOptikObermaterial: 100% BaumwolleMaterialzusammensetzungMaterial & ProduktdetailsDas geschmackvolle Rugbyshirt von Gant ist die richtige Wahl, wenn es um einen sportiven Look mit raffiniertem Twist geht. Auf der Brust des Regular-fit-Shirts befindet sich eine kleine, dezente Logostickerei. Der für dieses Modell typische Polokragen ist aus Twill gefertigt und besticht zusätzlich mit einem kontrastierenden Webband. Die kurzen, verstärkten Schlitze an den Seiten sorgen nicht nur für eine komfortable Passform, sondern sind auch optisch ein hübsches Beiwerk. Die angenehme, weiche Qualität des Shirts trägt sich komfortabel und bequem. Authentisch gestylt: mit dem Rugbyshirt von Gant.",otto-de,,https:https://i.otto.de/i/otto/22093037/gant-rugbyshirt-weiss-blau.jpg?$formatz$,,"S,M,L,XL,XXL,XXXL,4XL",https://www.otto.de/p/gant-rugbyshirt-617156913/,MEN,grau-blau,,,Gant Rugbyshirt
,1,EUR,604675296,,ALL,2018-02-21,https://www.otto.de/herrenmode/kategorien/pullover/?p=1&ps=72,otto-de,Troyer,https:https://i.otto.de/i/otto/20718725/mans-world-troyer-dunkelblau.jpg?$formatz$,"KnopfleisteVerschlussBadgeApplikationennormalPassformRippbündchenRumpfabschlussRippbündchenÄrmelabschlussLangarmÄrmelmit KnöpfenKragendetailsTroyerkragenKragencasualStilunifarbenOptikGrobstrickMaterialartObermaterial: 100% Baumwolle (unterstützt Cotton made in Africa)MaterialzusammensetzungMaterial & ProduktdetailsDas ist mal ein Must-have: Der Troyerpullover von Man’s World ist mit seiner Waschung ein trendiges Alltags-Piece. Dabei ist jeder Pullover ein Einzelstück, denn die Waschung fällt immer etwas anders aus. Mit Knöpfen am Troyerkragen bekommt der Strickpullover zusätzlich eine individuelle Note verliehen. Die Rippstrickbündchen bringen den lockeren Schnitt in Form und die weiche Qualität verwöhnt die Haut. In Kombination mit Bluejeans kommt der Herrenpullover besonders stilecht zur Geltung. Einfach mal ausprobieren – der Troyerpullover von Man’s World ist einfach ein Highlight!",otto-de,,https:https://i.otto.de/i/otto/20718725/mans-world-troyer-dunkelblau.jpg?$formatz$,,"S (44#ft5_slash#46),M (48#ft5_slash#50),L (52#ft5_slash#54),XL (56#ft5_slash#58),XXL (60#ft5_slash#62),XXXL (64#ft5_slash#66),4XL (68#ft5_slash#70),5XL (72#ft5_slash#74)",https://www.otto.de/p/mans-world-troyer-604675296/,MEN,dunkelblau,,,Man's World Troyer
,1,EUR,606203866,,ALL,2018-02-21,https://www.otto.de/herrenmode/kategorien/sakkos/?p=1&ps=72,otto-de,Casual Sakkos,https:https://i.otto.de/i/otto/20719889/bruno-banani-sakko-grau-meliert.jpg?$formatz$,"hängendAuslieferungIn Gr. 50 ca. 74 cmRückenlängeeinreihigVerschlussdetails2-Knopf-FormVerschlussaufgesetzte Taschen, InnentaschenTaschenRückenschlitzSchnittdetailsschmalPassformmit KnöpfenÄrmelabschlussdetailsgerader AbschlussÄrmelabschlussLangarmÄrmelReverskragenKragenmodischStilObermaterial: 84% Polyester, 15% Viskose, 1% Elasthan. Futter: 100% PolyesterMaterialzusammensetzungMaterial & ProduktdetailsSportlich und schick unterwegs sein – in dem leichten Sakko von Bruno Banani! Das schmal geschnittene Jackett ist in legerer Bouclé-Optik verarbeitet und setzt auf ein meliertes Gesamtbild. Neben den großen aufgesetzten Taschen, die den sportlichen Charakter dieser smarten Herrenjacke unterstreichen, erweisen sich Reverskragen und 2-Knopf-Form als sehr elegant. Durch den formstabilen Materialmix mit Stretchanteil ist die Jacke fast knitterfrei und garantiert Bewegungsfreiheit. Das Herrenjackett kann lässig mit verwaschenen Jeans und Printshirts kombiniert werden, macht aber auch in schicken Outfits eine super Figur. Alles kann, nichts muss – mit dem leichten Sakko von Bruno Banani!",otto-de,,https:https://i.otto.de/i/otto/20719889/bruno-banani-sakko-grau-meliert.jpg?$formatz$,,"44,46,48,50,52,54,56,58",https://www.otto.de/p/bruno-banani-sakko-606203866/,MEN,grau-meliert,,,Bruno Banani Sakko
,1,EUR,111594920,,ALL,2018-02-21,https://www.otto.de/herrenmode/kategorien/shirts/?p=1&ps=72,otto-de,Rundhals,https:https://i.otto.de/i/otto/14411138/h-i-s-langarmshirts-2-stueck-aus-baumwolle-grau-meliertplusschwarz.jpg?$formatz$,"Alles aus superelastischem, trageangenehmem Single-Jersey: 95% Baumwolle, 5% Elasthan.Super TragekomfortHochwertige GarneElastische BaumwolleSchöne Basic-Wäsche in super Passform für jeden Tag. Oberteile körpernah geschnitten.Material & Produktdetails",otto-de,,https:https://i.otto.de/i/otto/14411138/h-i-s-langarmshirts-2-stueck-aus-baumwolle-grau-meliertplusschwarz.jpg?$formatz$,,"XS(3),S(4),M(5),L(6),XL(7),XXL(8),XXXL(9)",https://www.otto.de/p/h-i-s-langarmshirts-2-stueck-aus-baumwolle-111594920/,MEN,2x schwarz,,,H.I.S Langarmshirts (2 Stück) aus Baumwolle
30.0,1,EUR,579790058,,ALL,2018-02-21,https://www.otto.de/herrenmode/kategorien/shorts/?p=1&ps=72,otto-de,Sportshorts,https:https://i.otto.de/i/otto/20341528/nike-sportswear-shorts-m-nsw-av15-fleece-short-schwarz.jpg?$formatz$,"liegendAuslieferungTunnelzugVerschlussEingrifftaschenTaschenLogodruckApplikationenkurzSchnittform LängeBasic schmalPassformgeradeBeinformsportlichStilObermaterial: 56% Baumwolle, 44% PolyesterMaterialzusammensetzungMaterial & ProduktdetailsMit athletischem Look und perfekten Trage-Eigenschaften sorgt die Männer-Shorts von Nike für sichtbar sportliche Performance. Dank des elastischen Taillenbunds mit Tunnelzugband sitzt die Sporthose beim Work-out und Training immer superbequem. Die schmal geschnittene Hose in Bermudas-Länge bekommt mit dem markanten Logoswoosh den obligatorischen Markenlook und mit seitlichen Eingrifftaschen einen lässigen Touch. Mit den jeweils passenden Shirts und Schuhen wird die Männershorts von Nike zum Trainingspartner für die Laufstrecke, das Fitnesstudio und die aktive Freizeit.",otto-de,,https:https://i.otto.de/i/otto/20341528/nike-sportswear-shorts-m-nsw-av15-fleece-short-schwarz.jpg?$formatz$,,"S (44#ft5_slash#46),M (48#ft5_slash#50),L (52#ft5_slash#54),XL (56#ft5_slash#58),XXL (60#ft5_slash#62)",https://www.otto.de/p/nike-sportswear-shorts-m-nsw-av15-fleece-short-579790058/,MEN,grau,4000.0,,Nike Sportswear Shorts »M NSW AV15 FLEECE SHORT«
34.95,1,EUR,571726347,,ALL,2018-02-21,https://www.otto.de/herrenmode/kategorien/sweatshirts-jacken/?p=1&ps=72,otto-de,Sweatshirts,https:https://i.otto.de/i/otto/19994316/adidas-performance-sweatshirt-ess-linaop-crew-marine.jpg?$formatz$,"liegendAuslieferungnavyHerstellerfarbbezeichnungca. 72 cmRückenlängeLogodruckApplikationenhüftlangSchnittform LängeengPassformBündchenÄrmelabschlussLangarmÄrmelRundhalsAusschnittsportlichStilgemustertOptikObermaterial: 70% Baumwolle, 30% Polyester (Recycling-Polyester)MaterialzusammensetzungMaterial & ProduktdetailsAuf dem Weg zum Sport stimmt das Sweatshirt von adidas Performance mit authentischem Design auf das Training ein! Der gerade geschnittene Pullover mit hochgeschlossenem Rundhalsausschnitt und Rippbündchen ist vorderseitig mit einem großen Logodruck bestückt, rückseitig hält der Sweater mit seinem Tarnmuster eine modische Überraschung bereit. Die Materialmischung mit hohem Baumwollanteil verspricht Komfort und auch abseits von Work-out und Trainingseinheit macht der Herrenpulli eine super Figur. Das Sweatshirt von adidas Performance beweist Stil – rund um die Uhr!",otto-de,,https:https://i.otto.de/i/otto/19994316/adidas-performance-sweatshirt-ess-linaop-crew-marine.jpg?$formatz$,,"S (44#ft5_slash#46),M (48#ft5_slash#50),L (52#ft5_slash#54),XL (56#ft5_slash#58),XXL (60#ft5_slash#62),XXXL (64#ft5_slash#66)",https://www.otto.de/p/adidas-performance-sweatshirt-ess-linaop-crew-571726347/,MEN,marine,5495.0,,adidas Performance Sweatshirt »ESS LINAOP CREW«
,1,EUR,602899425,,ALL,2018-02-21,https://www.otto.de/herrenmode/kategorien/sweatshirts-jacken/?p=2&ps=72,otto-de,Sweatshirts,https:https://i.otto.de/i/otto/24149781/adidas-originals-sweatshirt-curated-crew-q2-schwarz.jpg?$formatz$,"liegendAuslieferungIn Gr. M (48/50) ca. 70 cmRückenlängeLogostickereiApplikationenhüftlangSchnittform LängeschmalPassformRippbündchenRumpfabschlussRippbündchenÄrmelabschlussLangarmÄrmelRundhalsAusschnittsportlichStilInterlockMaterialartObermaterial: 67% Baumwolle, 33% PolyesterMaterialzusammensetzungMaterial & ProduktdetailsStylisches Basic-Sweatshirt von adidas Originals mit angesagter Crew-neck-Lösung, bei der der Rundhalsausschnitt direkt aus dem Sweatmaterial herausgearbeitet ist. Rippbündchen gibt es in dieser Variante nur am Saum und an den Ärmelenden. Die markentypische 3-Streifen-Optik und der Logoprint vorn bestimmen den coolen Look des langärmeligen Shirts aus besonders schwerer, hochwertiger Interlockware. Dadurch sieht es gleich viel hochwertiger aus und veredelt jedes Casual-Jeans-Outfit. Wer ein echtes Wohfühlteil sucht, das den klassischen Style von adidas Originals perfekt transportiert, für den ist dieses Sweatshirt genau richtig!",otto-de,,https:https://i.otto.de/i/otto/24149781/adidas-originals-sweatshirt-curated-crew-q2-schwarz.jpg?$formatz$,,"S (44#ft5_slash#46),M (48#ft5_slash#50),L (52#ft5_slash#54),XL (56#ft5_slash#58),XXL (60#ft5_slash#62)",https://www.otto.de/p/adidas-originals-sweatshirt-curated-crew-q2-602899425/,MEN,grau,,,adidas Originals Sweatshirt »CURATED CREW Q2«
,1,EUR,424619673,,ALL,2018-02-21,https://www.otto.de/herrenmode/accessoires/krawatten/?p=1&ps=72,otto-de,Breite Krawatten,https:https://i.otto.de/i/otto/15226178/bruno-banani-krawatte-set-mit-einstecktuch-rot.jpg?$formatz$,"6 cmBreiteschmalKrawattenformelegantStilKunstfaserMaterialObermaterial: 100% PolyesterMaterialzusammensetzungMaterial & ProduktdetailsModern, elegant und immer die richtige Wahl: Die schmale Krawatte und das passende Einstecktuch von Bruno Banani verleihen jedem Outfit eine elegante Note. Das Set besticht durch eines feines, seidig anmutendes Gewebe und überzeugt mit klassisch-maskuliner Optik. Der dezente Glanz rundet das exklusive Design der zeitlosen Businessaccessoires ab. Dank der unifarbenen Aufmachung lässt sich das 2er-Set aus strapazierfähiger und pflegeleichter Kunstfaser hervorragend mit jedem Anzug kombinieren. Die Krawatte und das Einstecktuch von Bruno Banani sorgen für einen souveränen Auftritt beim nächsten Business-Meeting oder Abendessen. Maskuliner Charme und Understatement mit großer Wirkung!",otto-de,,https:https://i.otto.de/i/otto/15226178/bruno-banani-krawatte-set-mit-einstecktuch-rot.jpg?$formatz$,,,https://www.otto.de/p/bruno-banani-krawatte-set-mit-einstecktuch-424619673/,MEN,grau,,,"Bruno Banani Krawatte (Set, mit Einstecktuch)"
79.99,1,EUR,601258050,,ALL,2018-02-21,https://www.otto.de/herrenmode/accessoires/schmuck/?p=1&ps=72,otto-de,Fitness-Armbänder,https:https://i.otto.de/i/otto/19488420/sportplus-fitness-armband-smartwatch-inklusive-2-armbaender-und-herzfrequenzmesser-q-band-hrplus-sp-at-ble-90-schwarz-blau.jpg?$formatz$,"Inkl. kostenloser i-gotU Life App zum DownloadAktivitäts- und BewegungserinnerungVibrationsalarm und WeckerfunktionSchlafüberwachung und -analyseAnzeige des ca. KalorienverbrauchsSchrittzählerAktivitäts-TrackingAnzeige der Herzfrequenz im SportmodusBenachrichtigung von Anruf, SMS, Kalendereinträgen, E-Mails und Social Apps(WhatsApp, Facebook usw.)Anzeige der aktuellen UhrzeitFunktionen:Lieferumfang: Activity Tracker, 2 Armbänder, USB Ladekabel, BedienungsanleitungAustauschbares, hautfreundliches TPU Armband aus Kunststoff in 2 verschiedenen Farben (Schwarz, Denim Blau)Maße (L/B/H): ca. 25/1,8/0,92 cmGewicht: ca. 15 gVibrationsalarm für Wecker und NotifikationSpritzwassergeschützt gemäß IPX7 (Schweiß, Regen)Akkulaufzeit bis zu 10 Tagen je nach Umfang der NutzungIntegrierter Lithium Polymer AkkuAutomatische FirmwareupdatesDisplay: 4-zeiliges OLED-Display (96x16 Pixel)Optischer HerzfrequenzsensorBewegungssensor: Ultra-low Power 3D G-Sensor für dreiaxiale BewegungserkennungFunktioniert mit kostenfreier i-gotU Life AppKompatibel zu iPhone ab 4S und Android Geräten ab 4.3 mit Bluetooth Smart TechnologieTechnische Daten:Der intelligente Begleiter für ein gesünderes Leben. Auf dem 4-zeiligen OLED-Display sind unter anderem Daten über die gegangenen Schritte und die ca. verbrannten Kalorien ablesbar. Sogar im Schlaf misst das Q-Band HR+ die Schlafqualität und gibt am nächsten Morgen Rückinfo darüber. Auf Wunsch funktioniert das Armband als Wecker und weckt durch geräuschlose Vibration. Darüber hinaus überzeugt es mit seinen Smart Watch Funktionen wie Anzeige der Uhrzeit, ankommende Anrufe, E-Mails, SMS oder Social Media Benachrichtigungen. Die austauschbaren Armbänder lassen sich angenehm tragen und sorgen dafür, dass das Fitnessarmband immer optimal zum Outfit passt. Der aufladbare Lithium Polymer Akku sorgt für eine Nutzung von bis zu 10 Tagen und lässt sich problemlos und schnell wieder aufladen. Über die tägliche Synchronisation mit der i-gotU Life App ist eine Übersicht über die Aktivitäten möglich, die mit Freunden oder sogar Ärzten geteilt werden kann. In Verbindung mit dem Sportmodus über die i-gotU Life App und der dynamischen Herzfrequenzmessung des Q-Band HR+ halten Sie auch beim Sport Ihren Puls im Blick.Material & Produktdetails",otto-de,,https:https://i.otto.de/i/otto/19488420/sportplus-fitness-armband-smartwatch-inklusive-2-armbaender-und-herzfrequenzmesser-q-band-hrplus-sp-at-ble-90-schwarz-blau.jpg?$formatz$,,,https://www.otto.de/p/sportplus-fitness-armband-smartwatch-inklusive-2-armbaender-und-herzfrequenzmesser-q-band-hrplus-sp-at-ble-90-601258050/,MEN,schwarz-blau,12999.0,,"Sportplus Fitness-Armband/Smartwatch, inklusive 2 Armbänder und Herzfrequenzmesser, »Q-Band HR+ SP-AT-BLE-90«"
,1,EUR,633013081,,ALL,2018-02-21,https://www.otto.de/herrenmode/accessoires/uhren/?p=1&ps=72,otto-de,Smartwatches,https:https://i.otto.de/i/otto/20680668/apple-watch-series-3-gps-plus-cellular-aluminiumgehaeuse-42mm-mit-sportarmband-silberfarben-nebel.jpg?$formatz$,"Weiteres Zubehör: Magnetisches Ladekabel, USB Power Adapter (Netzteil)Armband: JaZubehör im Lieferumfang:Akkulaufzeit (Betrieb): 18 StundenAkku & Betriebszeiten:Kompatible Betriebssysteme: iOS 11Kompatible Geräte: iPhone 6 oder neuerKompatibilität:Spritzwassergeschützt: JaWasserdicht: JaDisplaymaterial: Ion-X GlasGehäusematerial: AluminiumGehäuse und Armband:Betriebssystem: watchOS 4Betriebssystem / Software:Prozessor: Dual-CoreBesonderheiten: Anrufe tätigenSensoren: Höhenmesser, Pulssensor, Beschleunigungssensor, Gyroskop, UmgebungslichtFunktionen und Ausstattung:Mobilfunk: 4G, 3GGPS: JaWLAN: JaBluetooth: 4.2Datenübertragung/Anschlüsse:Interner Speicher (GB): 16 GBSpeicher:Helligkeit: 1000 Candela pro QuadratmeterAuflösung: 312 x 390 PixelTouchscreen: JaDisplaytechnologie: OLED RetinaDisplaygröße in Zoll: 1,65Displaygröße in cm: 4,2Display:Technische Details",otto-de,,https:https://i.otto.de/i/otto/20680668/apple-watch-series-3-gps-plus-cellular-aluminiumgehaeuse-42mm-mit-sportarmband-silberfarben-nebel.jpg?$formatz$,,,https://www.otto.de/p/apple-watch-series-3-gps-plus-cellular-aluminiumgehaeuse-42mm-mit-sportarmband-633013081/,MEN,Goldfarben#ft5_slash#Sandrosa,,,"Apple Watch Series 3 GPS + Cellular, Aluminiumgehäuse, 42mm mit Sportarmband"
,1,EUR,640212102,,ALL,2018-02-21,https://www.otto.de/herrenmode/accessoires/uhren/?p=2&ps=72,otto-de,Chronographen,https:https://i.otto.de/i/otto/21628459/boss-chronograph-the-professional-1513529-silberfarben-goldfarben.jpg?$formatz$,"FaltschließeVerschluss ArmbandMineralglasGlasTachymeterGehäusebesonderheitenIP-beschichtetArmbanddetailsbicolorArmbandoptikmattGehäuseoptik44 mmGehäusedurchmesser (ohne Krone)EdelstahlArmbandmaterialEdelstahlGehäusematerialsilberfarben, goldfarbenArmbandfarbesilberfarben, goldfarbenGehäusefarbeschwarzZifferblattfarbespritzwassergeschütztWasserdicht12/24-Std.-Anzeigezusätzliche FunktionenJaStoppfunktionanalogAnzeigeQuarzAntriebMaterial & ProduktdetailsDie Herrenarmbanduhr überzeugt voll und ganz durch ihr in moderner Eleganz gehaltenes Design. Der Zeitmesser begleitet seinen Träger stets stilvoll.",otto-de,,https:https://i.otto.de/i/otto/21628459/boss-chronograph-the-professional-1513529-silberfarben-goldfarben.jpg?$formatz$,,,https://www.otto.de/p/boss-chronograph-the-professional-1513529-640212102/,MEN,silberfarben-goldfarben,,,"Boss Chronograph »THE PROFESSIONAL, 1513529«"
,1,EUR,503929502,,ALL,2018-02-21,https://www.otto.de/herrenmode/accessoires/schmuck/?p=2&ps=72,otto-de,Fingerringe,https:https://i.otto.de/i/otto/14986440/firetti-partnerschmuck-partnerring-silberfarben.jpg?$formatz$,"Bei der Ermittlung Ihrer Ringgröße/Ringweite hilft Ihnen unser kostenloses Ringmaß. Dies können Sie sich mit der Artikelnummer 987661 vorab bestellen.Dieser massive Ring aus Edelstahl, in Matt/Glanz Optik hat einen Hauch von Ewigkeit. Durch das eingearbeitete Kreuz wird der Handschmuck zum himmlischen Begleiter für alle Verliebten. Die Ringschiene wird von einem aquafarbenen Zirkonia (synth.) geziert. Der Fingerring hat eine Breite von ca. 6 mm.firetti Partnerschmuck: Partnerring.Material & Produktdetails",otto-de,,https:https://i.otto.de/i/otto/14986440/firetti-partnerschmuck-partnerring-silberfarben.jpg?$formatz$,,"17 = 54 mm Umfang,18 = 56 mm Umfang,19 = 60 mm Umfang,20 = 62 mm Umfang,21 = 66 mm Umfang",https://www.otto.de/p/firetti-partnerschmuck-partnerring-503929502/,MEN,silberfarben,,,firetti Partnerschmuck: Partnerring
